{
  "$schema": "https://json-schema.org/draft/2020-12/schema",
  "type": "object",
  "properties": {
    "schema": {
      "type": "string",
      "const": "intyy.cassette/1.0"
    },
    "run_id": {
      "type": "string",
      "pattern": "^run_\\d{4}-\\d{2}-\\d{2}_[0-9a-hjkmnp-tv-z]{10}$"
    },
    "model": {
      "type": "string",
      "minLength": 1
    },
    "prompt": {
      "type": "string",
      "minLength": 1
    },
    "system": {
      "type": "string",
      "pattern": "^sha256:[0-9a-f]{64}$"
    },
    "turns": {
      "minItems": 1,
      "type": "array",
      "items": {
        "type": "object",
        "properties": {
          "message": {
            "type": "string"
          },
          "reply": {
            "type": "object",
            "properties": {
              "call": {
                "anyOf": [
                  {
                    "type": "object",
                    "properties": {
                      "name": {
                        "type": "string",
                        "minLength": 1
                      },
                      "input": {}
                    },
                    "required": [
                      "name",
                      "input"
                    ],
                    "additionalProperties": false
                  },
                  {
                    "type": "null"
                  }
                ]
              },
              "model": {
                "type": "string",
                "minLength": 1
              },
              "usage": {
                "type": "object",
                "properties": {
                  "input_tokens": {
                    "type": "integer",
                    "minimum": -9007199254740991,
                    "maximum": 9007199254740991
                  },
                  "output_tokens": {
                    "type": "integer",
                    "minimum": -9007199254740991,
                    "maximum": 9007199254740991
                  }
                },
                "required": [
                  "input_tokens",
                  "output_tokens"
                ],
                "additionalProperties": false
              }
            },
            "required": [
              "call",
              "model",
              "usage"
            ],
            "additionalProperties": false
          }
        },
        "required": [
          "message",
          "reply"
        ],
        "additionalProperties": false
      }
    }
  },
  "required": [
    "schema",
    "run_id",
    "model",
    "prompt",
    "system",
    "turns"
  ],
  "additionalProperties": false
}
