{
  "schema": "intyy.cassette/1.0",
  "run_id": "run_2026-09-29_qhkn64cebx",
  "model": "claude-sonnet-5",
  "prompt": "discovery@1.0",
  "system": "sha256:346f3a1ed938b7578749f4cee12d4200abc1ab26a66bb592d52df4b741f58d67",
  "turns": [
    {
      "message": "<progress turn=\"1\" limit=\"40\" last=\"none\" />\n<history>\n(none yet)\n</history>\n<screen location=\"/login.do\" title=\"KVFCU :: Login\">\ne1 table \"» Login 01/15/2026 Keystone Valley Federal Credit Union Internet Banking — Staf…\" {\n  e2 row \"» Login 01/15/2026\" {\n    e3 cell \"» Login 01/15/2026\" {\n      e4 table \"» Login 01/15/2026\" {\n        e5 row \"» Login 01/15/2026\" {\n          e6 cell \"» Login\"\n          e7 cell \"01/15/2026\"\n        }\n      }\n    }\n  }\n  e8 row \"Keystone Valley Federal Credit Union Internet Banking — Staff Operations Staff …\" {\n    e9 cell \"Keystone Valley Federal Credit Union Internet Banking — Staff Operations Staff …\" {\n      e10 table \"Keystone Valley Federal Credit Union Internet Banking — Staff Operations\" {\n        e11 row \"Keystone Valley Federal Credit Union Internet Banking — Staff Operations\" {\n          e12 cell \"Keystone Valley Federal Credit Union Internet Banking — Staff Operations\" {\n            e13 generic \"Keystone Valley Federal Credit Union\"\n          }\n        }\n      }\n      e14 table \"Staff Login User ID Password Do not press Back or Refresh buttons while a trans…\" {\n        e15 row \"Staff Login User ID Password Do not press Back or Refresh buttons while a trans…\" {\n          e16 cell \"Staff Login User ID Password Do not press Back or Refresh buttons while a trans…\" {\n            e17 form \"Staff Login User ID Password\" {\n              e18 table \"Staff Login User ID Password\" {\n                e19 row \"Staff Login\" {\n                  e20 columnheader \"Staff Login\"\n                }\n                e21 row \"User ID\" {\n                  e22 cell \"User ID\"\n                  e23 cell {\n                    e24 textbox \"User ID\"\n                  }\n                }\n                e25 row \"Password\" {\n                  e26 cell \"Password\"\n                  e27 cell {\n                    e28 textbox \"Password\"\n                  }\n                }\n                e29 row {\n                  e30 cell {\n                    e31 button \"Login\"\n                    e32 button \"Clear\"\n                  }\n                }\n              }\n            }\n            e33 generic \"Do not press Back or Refresh buttons while a transaction is in progress.\"\n            e34 generic \"Unauthorised access to this system is prohibited and punishable under law.\"\n          }\n        }\n      }\n    }\n  }\n  e35 row \"Best viewed in Internet Explorer 6.0 at 1024x768 resolution. © 2008 Keystone Va…\" {\n    e36 cell \"Best viewed in Internet Explorer 6.0 at 1024x768 resolution. © 2008 Keystone Va…\" {\n      e37 table \"Best viewed in Internet Explorer 6.0 at 1024x768 resolution. © 2008 Keystone Va…\" {\n        e38 row \"Best viewed in Internet Explorer 6.0 at 1024x768 resolution. © 2008 Keystone Va…\" {\n          e39 cell \"Best viewed in Internet Explorer 6.0 at 1024x768 resolution. © 2008 Keystone Va…\" {\n            e40 link \"NCUA\"\n          }\n        }\n      }\n    }\n  }\n}\n</screen>",
      "reply": {
        "call": {
          "name": "type",
          "input": {
            "element": "e24",
            "value": "{secret.operator_username}",
            "reason": "Enter operator username into User ID field",
            "expected": "User ID field populated with operator username",
            "tag": "flow_step"
          }
        },
        "model": "claude-sonnet-5",
        "usage": {
          "input_tokens": 2687,
          "output_tokens": 151
        }
      }
    },
    {
      "message": "<progress turn=\"2\" limit=\"40\" last=\"ok\" />\n<history>\nt1 type e24 {secret.operator_username} → ok  [flow_step]\n</history>\n<screen location=\"/login.do\" title=\"KVFCU :: Login\">\ne1 table \"» Login 01/15/2026 Keystone Valley Federal Credit Union Internet Banking — Staf…\" {\n  e2 row \"» Login 01/15/2026\" {\n    e3 cell \"» Login 01/15/2026\" {\n      e4 table \"» Login 01/15/2026\" {\n        e5 row \"» Login 01/15/2026\" {\n          e6 cell \"» Login\"\n          e7 cell \"01/15/2026\"\n        }\n      }\n    }\n  }\n  e8 row \"Keystone Valley Federal Credit Union Internet Banking — Staff Operations Staff …\" {\n    e9 cell \"Keystone Valley Federal Credit Union Internet Banking — Staff Operations Staff …\" {\n      e10 table \"Keystone Valley Federal Credit Union Internet Banking — Staff Operations\" {\n        e11 row \"Keystone Valley Federal Credit Union Internet Banking — Staff Operations\" {\n          e12 cell \"Keystone Valley Federal Credit Union Internet Banking — Staff Operations\" {\n            e13 generic \"Keystone Valley Federal Credit Union\"\n          }\n        }\n      }\n      e14 table \"Staff Login User ID Password Do not press Back or Refresh buttons while a trans…\" {\n        e15 row \"Staff Login User ID Password Do not press Back or Refresh buttons while a trans…\" {\n          e16 cell \"Staff Login User ID Password Do not press Back or Refresh buttons while a trans…\" {\n            e17 form \"Staff Login User ID Password\" {\n              e18 table \"Staff Login User ID Password\" {\n                e19 row \"Staff Login\" {\n                  e20 columnheader \"Staff Login\"\n                }\n                e21 row \"User ID\" {\n                  e22 cell \"User ID\"\n                  e23 cell {\n                    e24 textbox \"User ID\" value:\"[secret]\"\n                  }\n                }\n                e25 row \"Password\" {\n                  e26 cell \"Password\"\n                  e27 cell {\n                    e28 textbox \"Password\"\n                  }\n                }\n                e29 row {\n                  e30 cell {\n                    e31 button \"Login\"\n                    e32 button \"Clear\"\n                  }\n                }\n              }\n            }\n            e33 generic \"Do not press Back or Refresh buttons while a transaction is in progress.\"\n            e34 generic \"Unauthorised access to this system is prohibited and punishable under law.\"\n          }\n        }\n      }\n    }\n  }\n  e35 row \"Best viewed in Internet Explorer 6.0 at 1024x768 resolution. © 2008 Keystone Va…\" {\n    e36 cell \"Best viewed in Internet Explorer 6.0 at 1024x768 resolution. © 2008 Keystone Va…\" {\n      e37 table \"Best viewed in Internet Explorer 6.0 at 1024x768 resolution. © 2008 Keystone Va…\" {\n        e38 row \"Best viewed in Internet Explorer 6.0 at 1024x768 resolution. © 2008 Keystone Va…\" {\n          e39 cell \"Best viewed in Internet Explorer 6.0 at 1024x768 resolution. © 2008 Keystone Va…\" {\n            e40 link \"NCUA\"\n          }\n        }\n      }\n    }\n  }\n}\n</screen>",
      "reply": {
        "call": {
          "name": "type",
          "input": {
            "element": "e28",
            "value": "{secret.operator_password}",
            "reason": "Enter the operator password to proceed with login.",
            "expected": "Password field populated with masked characters.",
            "tag": "flow_step"
          }
        },
        "model": "claude-sonnet-5",
        "usage": {
          "input_tokens": 2717,
          "output_tokens": 155
        }
      }
    },
    {